{
  "name": "ghost-bazaar",
  "cwd": "/home/berkay/dev/ghost-bazaar",
  "status": "severed",
  "reason": "weekly_util",
  "priority": "low",
  "utilization_at_trip": 88.0,
  "signal_tier": "oauth",
  "tmux_pane": "%3",
  "severed_at": "2026-07-02T12:00:00Z",
  "resume_at": "2026-07-07T09:00:00Z",
  "resume_count": 0,
  "paused": false,
  "session_id": "sess-week-01"
}
