{
  "name": "gaia-platform",
  "cwd": "/home/berkay/dev/gaia-platform",
  "status": "active",
  "reason": null,
  "priority": "critical",
  "preempted_by": null,
  "session_cost_usd": 4.87,
  "limit_usd": null,
  "signal_tier": "statusline",
  "session_id": "sess-1",
  "resume_count": 0,
  "blocked_count": 0,
  "paused": false,
  "ts": 1751450000
}
